{
  "v": 1,
  "question": "Which three Uniswap v4 pools paired with IMD had the most swap volume in the last 24 hours?",
  "chainId": 1,
  "window": {
    "hours": 24
  },
  "answerType": "bytes32[]",
  "evidence": "chain",
  "head": 3,
  "panelSize": 7,
  "quorum": 5,
  "validForSeconds": 86400,
  "guards": {
    "deny": [
      "0x0000000000000000000000000000000000000000000000000000000000000000"
    ]
  }
}
